<?xml version="1.0" encoding="UTF-8" ?>
        <!ELEMENT gameMoves (gameMove+)>
        <!ELEMENT gameMove (player, gameMoveType, tileName, time)>
        <!ELEMENT player (#PCDATA)>
        <!ELEMENT gameMoveType (#PCDATA)>
        <!ELEMENT tileName (#PCDATA)>
        <!ELEMENT time (#PCDATA)>
